{
  "apiVersion": "hairness.dev/extension/v1alpha1",
  "kind": "Extension",
  "metadata": { "id": "hairness/cockpit", "version": "0.3.0-alpha.0", "summary": "Home orientation and progressive onboarding." },
  "spec": {
    "provides": ["hairness.cockpit"],
    "requires": [],
    "recipes": [
      { "id": "hairness", "path": "recipes/hairness.md", "summary": "Orient the user and show the next useful route.", "capability": "hairness.cockpit" },
      { "id": "hairness-onboarding", "path": "recipes/onboarding.md", "summary": "Complete resumable Home onboarding.", "capability": "hairness.cockpit" }
    ],
    "adapters": [],
    "schemas": [],
    "gates": [],
    "onboarding": [],
    "tests": []
  }
}
